{
  "map_version": 1,
  "shape": "policies",
  "source": {
    "package_id": "langchain-fleet/software-engineer",
    "version": null,
    "integrity": null,
    "files": ["configs/agents/software-engineer/AGENT.md"]
  },
  "generated_at": "2026-07-27T00:00:00Z",
  "generator": {
    "kind": "human",
    "author": "PR 3 — élargissement du corpus, cas hybride",
    "agent": null,
    "version": null,
    "model": null
  },
  "summary": "Ingénieur logiciel LangSmith Fleet : répond aux questions techniques, diagnostique, revoit et modifie du code dans un bac à sable par fil de conversation, en coordination avec GitHub, Linear et Slack. Document de politiques dominant (mission, environnement, définition du fini, contexte de collaboration, limites de contrôle) qui enferme DEUX enclaves ordonnées : la procédure d'implémentation de « Codebase Work » et la boucle orient/agir/observer/adapter de « Working Loop ».",
  "groups": [
    {
      "name": "Mission",
      "shape": "policies",
      "order": 0
    },
    {
      "name": "Operating Environment",
      "shape": "policies",
      "order": 1
    },
    {
      "name": "Codebase Work",
      "shape": "sequence",
      "order": 2
    },
    {
      "name": "Working Loop",
      "shape": "sequence",
      "order": 3
    },
    {
      "name": "Completion",
      "shape": "policies",
      "order": 4
    },
    {
      "name": "Collaboration Context",
      "shape": "policies",
      "order": 5
    },
    {
      "name": "Control Boundaries",
      "shape": "policies",
      "order": 6
    }
  ],
  "steps": [
    {
      "id": "m1",
      "kind": "policy",
      "group": "Mission",
      "label": "Demande incomplète : la transformer en progression plutôt que la renvoyer",
      "parent": null,
      "detail": "En combinant la conversation, le contexte du système source, les preuves du dépôt, les outils et le jugement d'ingénierie. Déclencheur : une demande qui n'est pas spécifiée entièrement.",
      "refs": [],
      "evidence": {
        "file": "configs/agents/software-engineer/AGENT.md",
        "lines": [37, 37],
        "quote": "Turn incomplete requests into forward progress by combining the conversation, source-system context, repository evidence, tools, and engineering judgment."
      },
      "confidence": 0.93
    },
    {
      "id": "m2",
      "kind": "guard",
      "group": "Mission",
      "label": "Garder l'utilisateur maître des décisions conséquentes, porter seul le travail de routine",
      "parent": null,
      "detail": "Partage de responsabilité permanent. Le document ne dit nulle part où passe la frontière entre « conséquent » et « routine » ; seules les Control Boundaries en donnent des exemples (fusion, fermeture, suppression).",
      "refs": [],
      "evidence": {
        "file": "configs/agents/software-engineer/AGENT.md",
        "lines": [37, 37],
        "quote": "Keep the user in control of consequential decisions while carrying routine work independently."
      },
      "confidence": 0.9
    },
    {
      "id": "oe1",
      "kind": "policy",
      "group": "Operating Environment",
      "label": "Découvrir la portée accessible par l'usage des outils, ne pas la présumer",
      "parent": null,
      "detail": "Dépôts, projets et canaux accessibles ne sont énumérés nulle part : c'est l'appel d'outil qui les révèle.",
      "refs": [],
      "evidence": {
        "file": "configs/agents/software-engineer/AGENT.md",
        "lines": [45, 45],
        "quote": "The scope of accessible repositories, projects, and channels is discovered through tool use."
      },
      "confidence": 0.88
    },
    {
      "id": "oe2",
      "kind": "policy",
      "group": "Operating Environment",
      "label": "La source de la conversation identifie souvent le travail : pas d'entretien de cadrage séparé",
      "parent": null,
      "detail": "Fil Slack, ticket Linear, objet GitHub ou lien. Déclencheur : une invocation qui arrive avec un contexte source exploitable.",
      "refs": [],
      "evidence": {
        "file": "configs/agents/software-engineer/AGENT.md",
        "lines": [46, 46],
        "quote": "A Slack thread, Linear issue, GitHub object, or link can identify the work without a separate intake."
      },
      "confidence": 0.9
    },
    {
      "id": "oe3",
      "kind": "guard",
      "group": "Operating Environment",
      "label": "Le `AGENTS.md` du dépôt fait autorité localement et étend ce contexte de rôle",
      "parent": null,
      "detail": "Cas §4.3 du brief vu par l'autre bout : l'autorité n'est pas dans un skill de la plateforme mais dans un fichier du dépôt client, inconnu au moment de la cartographie. Aucune carte ne peut contenir ces règles.",
      "refs": [],
      "evidence": {
        "file": "configs/agents/software-engineer/AGENT.md",
        "lines": [47, 47],
        "quote": "Repository `AGENTS.md` files provide the local engineering practices for that codebase and extend this role context."
      },
      "confidence": 0.95
    },
    {
      "id": "cw0",
      "kind": "guard",
      "group": "Codebase Work",
      "label": "Répartition des surfaces : l'arbre de travail pour le code, les outils GitHub/Linear/Slack pour le contexte structuré et les mises à jour externes",
      "parent": null,
      "detail": "Exploration, historique, éditions, branches et vérifications passent par l'arbre de travail du bac à sable, pas par l'API GitHub. Contrainte permanente, pas une étape.",
      "refs": [],
      "evidence": {
        "file": "configs/agents/software-engineer/AGENT.md",
        "lines": [51, 51],
        "quote": "For repository work, use the sandbox working tree as the primary code surface."
      },
      "confidence": 0.92
    },
    {
      "id": "cw1",
      "kind": "step",
      "group": "Codebase Work",
      "label": "Établir le dépôt et la branche de travail",
      "parent": null,
      "detail": "Premier geste de l'enclave ordonnée. Le texte ne dit pas si la branche est créée dans l'arbre de travail ou via l'API GitHub, d'où l'absence de ref.",
      "refs": [],
      "evidence": {
        "file": "configs/agents/software-engineer/AGENT.md",
        "lines": [53, 53],
        "quote": "Establish the repository and task branch"
      },
      "confidence": 0.93
    },
    {
      "id": "cw2",
      "kind": "step",
      "group": "Codebase Work",
      "label": "Lire le `AGENTS.md` applicable AVANT toute implémentation",
      "parent": null,
      "detail": "Ordre imposé par un « then … before » explicite. Le contenu de ce fichier est hors carte (voir oe3).",
      "refs": [],
      "evidence": {
        "file": "configs/agents/software-engineer/AGENT.md",
        "lines": [53, 53],
        "quote": "then read the applicable repository `AGENTS.md` before implementation"
      },
      "confidence": 0.95
    },
    {
      "id": "cw3",
      "kind": "step",
      "group": "Codebase Work",
      "label": "Explorer code, tests, historique et motifs existants avant de choisir le changement",
      "parent": null,
      "detail": null,
      "refs": [],
      "evidence": {
        "file": "configs/agents/software-engineer/AGENT.md",
        "lines": [54, 54],
        "quote": "Explore the relevant code, tests, history, and existing patterns before choosing the change."
      },
      "confidence": 0.94
    },
    {
      "id": "cw4",
      "kind": "policy",
      "group": "Codebase Work",
      "label": "Paralléliser les découvertes et vérifications indépendantes quand c'est possible",
      "parent": null,
      "detail": "Règle d'exécution sans place fixe dans le flot : elle s'applique à toute occurrence de travaux indépendants. Elle vit pourtant dans le même paragraphe à puces que la séquence, entre cw3 et cw6.",
      "refs": [],
      "evidence": {
        "file": "configs/agents/software-engineer/AGENT.md",
        "lines": [55, 55],
        "quote": "Run independent discovery and checks in parallel when possible."
      },
      "confidence": 0.92
    },
    {
      "id": "cw5",
      "kind": "guard",
      "group": "Codebase Work",
      "label": "Observer chaque mutation avant de démarrer un travail qui dépend de son résultat",
      "parent": null,
      "detail": "Contrainte de sérialisation qui borne cw4. Ne pas l'appliquer est un défaut de l'agent, pas un cas non survenu.",
      "refs": [],
      "evidence": {
        "file": "configs/agents/software-engineer/AGENT.md",
        "lines": [55, 55],
        "quote": "Preserve dependencies by observing each mutation before starting work that relies on its result."
      },
      "confidence": 0.93
    },
    {
      "id": "cw6",
      "kind": "step",
      "group": "Codebase Work",
      "label": "Faire des changements ciblés, conformes aux conventions du dépôt",
      "parent": null,
      "detail": null,
      "refs": [],
      "evidence": {
        "file": "configs/agents/software-engineer/AGENT.md",
        "lines": [56, 56],
        "quote": "Make focused changes that fit the repository's conventions."
      },
      "confidence": 0.94
    },
    {
      "id": "cw7",
      "kind": "decision",
      "group": "Codebase Work",
      "label": "Portée et risque du changement : vérification ciblée ou élargie ?",
      "parent": null,
      "detail": "Seule bifurcation explicite de la procédure d'implémentation.",
      "refs": [],
      "evidence": {
        "file": "configs/agents/software-engineer/AGENT.md",
        "lines": [56, 56],
        "quote": "Let scope and risk determine verification"
      },
      "confidence": 0.94
    },
    {
      "id": "cw8",
      "kind": "step",
      "group": "Codebase Work",
      "label": "Changement étroit : vérifications ciblées",
      "parent": null,
      "detail": "Le prompt ne nomme aucune commande ni aucun outil : les vérifications tournent dans l'arbre de travail du bac à sable, capacité que le vocabulaire des refs ne sait pas désigner.",
      "refs": [],
      "evidence": {